Title,ERA Score
International Cognitive Robotics Conference COGROBO,B
International Colloquium on Automata Languages and Programming ICALP,A
"International Colloquium on Data Sciences, Knowledge Discovery and Business Intelligence DSKDB",C
International Colloquium on Structural Information and Communication Complexity SIROCCO,B
International Colloquium on Theoretical Aspects of Computing ICTAC,B
International Command and Control Research and Technology Symposium ICCRTS,C
International Computer Science Conference ICSC,B
International Computer Science Symposium in Russia CSR,C
International Computer Software and Applications Conference COMPSAC,B
International Computing Education Research Workshop ICER,B
International Conference and Exhibition on High Performance Computing in the Asia-Pacific Region HPC Asia,B
"International Conference Computer Graphics, Imaging and Visualization CGIV",C
"International Conference for Bulk Materials Storage, Handling and Transportation",A
International Conference Formal Concept Analysis Conference ICFCA,C
"International Conference Imaging Science, Systems and Technology CISST",C
International Conference in Business Process Management BPM,A
"International Conference of Broadband Communication, Information Technology and Biomedical Applications broadcom",C
International Conference of Society for Group Decision and Negotiation GDN,B
International Conference of the International Association for Computer Methods and Advances in Geomechanics IACMAG,A
International Conference of Z and,B
International Conference of Z Users ZUSER,C
International Conference on 3G Mobile Communication Technologies 3G,C
International Conference on Adaptive and Natural Computing Algorithms ICANNGA,C
International Conference on AD-HOC Networks and Wireless ADHOC-NOW,B
International Conference on Advanced Computing and Communications AdCom,B
International Conference on Advanced Data Mining and Applications ADMA,B
International Conference on Advanced Information Management IMS,C
International Conference on Advanced Information Networking and Applications (was ICOIN) AINA,B
International Conference on Advanced Information Systems Engineering CaiSE,A
International Conference on Advanced Language Processing and Web Information Technology ALPIT,C
International Conference on Advanced Materials Processing,B
International Conference on Advances and Trends in Engineering Materials and Their Applications,A
International Conference on Advances in Computer-Human Interactions ACHI,C
"International Conference on Advances in Infrastructure for Electronic Business, Science, and Education on the Internet SSGRR",C
International Conference on Advances in Intelligent Systems: Theory and Applications AISTA,B
International Conference on Advances in Materials and Processing Technologies,A
International Conference on Advances in Mobile Computing and Multimedia MOMM,B
International Conference on Advances in Pattern Recognition and Digital Techniques ICAPRDT,C
International Conference on Affective Computing and Intelligent ACII,C
International Conference on Agents and Artificial Intelligence ICAART,C
International Conference On Agile Manufacturing,A
International Conference on Algebraic and Logic Programming ALP,B
International Conference on Algorithms and Architectures for Parallel Processing ICA3PP,B
International Conference on Algorithms and Complexity (was Italian Conference ) CIAC,C
International Conference on Applied Cryptography and Network Security ACNS,B
International Conference on Apps for Specific Array Processors ASAP,A
International Conference on Artificial Intelligence IC-AI,C
International Conference on Artificial Intelligence and Law ICAIL,C
International Conference on Artificial Intelligence and Pattern Recognition AIPR,C
International Conference on Artificial Intelligence and Soft Computing ICAISC,C
International Conference on Artificial Intelligence and Statistics AISTATS,B
International Conference on Artificial Intelligence in Science and Technology AISAT,C
International Conference on Artificial Neural Networks ICANN,B
International Conference on Artificial Reality and Telexistence ICAT,B
International Conference on Arts and Technology ArtsIT,C
International Conference on Automated Deduction CADE,A
International Conference on Automated Planning and Scheduling ICAPS,A
"International Conference on Automation, Robotics and Control Systems ARCS",C
International Conference on Autonomic and Trusted Computing ATC,C
International Conference on Autonomous Agents and Multiagent Systems AAMAS,A
"International Conference on Availability, Reliability and Security ARES",B
International Conference on Biomedical and Pharmaceutical Engineering,B
"International Conference on Broadband Communications, Networks and Systems Broadnets",B
International Conference on Business Information Systems BIS,B
"International Conference on CAD/CAM, Robotics and Factories of the Future RFF",C
International Conference on Case-Based Reasoning Research and Development ICCBR,C
International Conference on Chinese Computing ICCC,C
"International Conference on Civil, Structural and Environmental Engineering Computing CIVIL-COMP",A
International Conference on Cloud Computing CloudCom,C
International Conference on Coastal Engineering,A
"International Conference on Collaborative Computing: Networks, Applications and Worksharing CollaborateCom",C
International Conference on Communication System Software and Middleware COMSWARE,C
International Conference on Communications in Computing CIC,C
International Conference on Compiler Construction CC,A
"International Conference on Compilers, Architecture, and Synthesis for Embedded Systems CASES",A
International Conference on Complex Systems CxS,C
"International Conference on Complex, Intelligent and Software Intensive Systems CISIS",C
International Conference on Composite Materials,A
International Conference on Computability and Complexity in Analysis CCA,C
"International Conference on Computational Collective Intelligence: Semantic Web, Social Networks and Multiagent Systems ICCCI",C
International Conference on Computational Engineering Science ICES,C
International Conference on Computational Intelligence and Multimedia ICCIMA,C
International Conference on Computational Intelligence and Security CIS,C
International Conference on Computational Intelligence and Software Engineering CISE,C
"International Conference on Computational Intelligence for Modelling, Control and Automation CIMCA",C
"International Conference on Computational Intelligence, Robotics and Autonomous Systems CIRAS",C
International Conference on Computational Linguistics COLING,A
International Conference on Computational Molecular Biology RECOMB,B
International Conference on Computational Plasticity COMPLAS,A
International Conference on Computational Science ICCS,A
International Conference on Computational Science and Applications ICCSA,C
International Conference on Computational Semiotics for Games and New Media Cosign,C
International Conference on Computer Analysis of Images and Patterns CAIP,B
International Conference on Computer and Information Technology ICCIT,C
International Conference on Computer Graphics and Interactive Techniques in Australasia and Southeast Asia SIGGRAPH ASIA,B
International Conference on Computer Graphics Theory and Application GRAPP,A
"International Conference on Computer Graphics, Virtual Reality, Visualisation and Interaction in Africa AFRIGRAPH",C
International Conference on Computer Information Systems and Industrial Management Applications CISIM,C
"International Conference on Computer Safety, Reliability and Security SAFECOMP",B
International Conference on Computer Supported Cooperative Work in Design CSCWD,B
International Conference on Computer Theory and Applications ICCTA,C
International Conference on Computer Vision Systems ICVS,C
International Conference on Computers and their Applications CATA,C
International Conference on Computers Helping People with Special Needs ICCHP,C
International Conference on Computers in Education ICCE,B
International Conference on Computers in Urban Planning and Urban Management CUPUM,A
International Conference on Computing and Combinatorics COCOON,A
International Conference on Computing and Informatics ICOCI,C
International Conference on Conceptual Modelling ER,A
International Conference on Conceptual Structures ICCS,B
International Conference on Concurrency Theory CONCUR,A
International Conference on Construction and Real Estate Management ICCREM,B
International Conference on Construction Engineering and Management ICCEM,C
International Conference on Construction in Developing Countries ICCIDC,C
"International Conference on Control, Automation, Robotics and Vision ICARCV",A
International Conference on Convergence and Hybrid Information Technology ICHIT,C
International Conference on Cooperative Information Systems CoopIS,A
International Conference on Coordination Models and Languages Coordination,A
International Conference on Creating Connecting and Collaborating through Computing C5,C
International Conference on Cryptology and Network Security CANS,B
International Conference on Cryptology in India INDOCRYPT,B
International Conference on Cybercrime Forensics Education and Training CFET,C
International Conference on Cyberworlds (was International Symposium on Cyberworlds) CW,B
International Conference on Data Engineering ICDE,A
International Conference on Database and Expert Systems Applications DEXA,B
International Conference on Database Systems for Advanced Applications DSAA,C
International Conference on Database Theory ICDT,A
International Conference on Declarative Programming and Knowledge Management INAP,C
International Conference on Dependability of Computer Systems DEPCoS,C
"International Conference on Dependable, Autonomic and Secure Computing DASC",C
International Conference on Design Science Research in Information Systems and Technology DESRIST,A
International Conference on Design Theory and Methodology (ASME) DTM,A
"International Conference on Digital Content, Multimedia Technology and its Applications IDC",C
International Conference on Digital Government Research DGO,B
International Conference on Digital Society ICDS,C
International Conference on Discrete Geometry for Computer Imagery DGCI,C
International Conference on Discrete Mathematics and Theoretical Computer Science DMTCS,B
