id,title,acronym,paper_count,paper_text,status
ASCILITE,Australasian Society for Computers in Learning in Tertiary Education Conference,ASCILITE,30,"Learning Analytics Special Interest Group: The ascilite Learning Analytics Special Interest Group (LA SIG) aims to promote and develop awareness and resources surrounding Learning Analytics and its application to learning and teaching. The LA SIG sharing practice session will: ???? facilitate networking for LA researchers and practitioners; ???? facilitate sharing of outstanding practice in LA via presentations from the three finalists in the LA SIG Awards program. The Awards finalists will share their experiences and lessons learned in relation to their nominated projects/practices. The 2015 Award winner will also be announced during the session; and provide updates on what’s happening in the Learning Analytics community within Australia/New Zealand and beyond. The session will have the following structure: 1. Latest developments in the Learning Analytics community in Australia/NZ and an update from the Society of Learning Analytics Research (Dr Grace Lynch and Dr Abelardo Pardo) 2. Presentations from the finalists for the 2015 Award for Excellence in Learning Analytics: moderated by Simon Welsh 3. Discussion and Q&A: moderated by Simon Welsh 4. Announcement of the 2015 Award winner: Dr Grace Lynch and Dr Abelardo Pardo.

Learning Analytics in the Classroom: The field of learning analytics has progressed significantly since the first Learning Analytics and Knowledge (LAK) conference in 2011. In recent years, the emphasis on technical and statistical aspects of data and analytics has given way to a greater emphasis on what these data mean in the classroom context. This panel session is aimed at examining the emerging role that data and analytics play in understanding and supporting student learning in higher education. Specifically, the panel will focus on the importance of transdisciplinarity and how translation from data to action can occur in the classroom context. The aim of this session is to broaden the conversation about learning analytics within the ASCILITE community. From there, the panel will discuss ways in which learning analytics can have a greater impact on learning design in physical and digital learning environments.

ascilite and the Carrick Resource Identification Network project: ascilite, in partnership with education.au and ACODE, have completed a preliminary investigation for this project with The Carrick Institute of Learning and Teaching in Higher Education. This session will provide an overview of ascilite's contribution and will also explore education.au's models of use to engage higher education. We will call for expressions of interest from ascilite members to contribute to the next stage of the project.
 

Assurance of learning in the age of AI: As Artificial Intelligence (AI) continues to evolve and influence higher education, ensuring that Assurance of Learning (AoL) frameworks remain both robust and adaptable, is vital. This paper presents a qualitative document analysis of Australian university AoL frameworks, examining their readiness for AI integration. The findings reveal a sector in early adaptation, marked by a tension between foundational AoL principles and AI's disruptive pace. We observe strategic AI acknowledgement often confined to policy, a nascent reform of graduate attributes to encompass AI literacy, and innovative practices largely isolated at the course or program level. Consequently, core AoL components such as curriculum mapping and assessment design, often remain disconnected from AI-assisted learning, limiting their reliability. This highlights significant conceptual and operational gaps, including varied institutional maturity, fragmented approaches, and a lack of sector-wide consensus or explicit guidance on ethical, observable AI-enhanced assessment. This paper calls for a shift from static quality assurance, defined by periodic compliance checks, to dynamic and systems-aware learning assurance. It proposes a future-focused AoL approach that embeds AI literacy, inclusive assessment design and stronger sector collaboration. As the first in a series, it contributes to ASCILITE 2025 by exploring how human expertise and AI can uphold academic standards.

The evolution of an LMS: ""Cecil, the First Web-Based LMS"" (ASCILITE, 2002) described how The University of Auckland's home grown LMS originated. Now - fifteen years on we describe the challenge of maintaining such a system given of the evolution of computer hardware and software and the increasing sophistication of its users. Over time we have made the transition to the latest processors and database architectures and at present we are running a pilot to replace a significant a amount of our own code with Microsoft Office SharePoint Services (MOSS) - while seeking to retain the original functions and features including a bodies of knowledge (taxonomy), gradebook, assessment engine and communications modules. One important outcome of the pilot is to relieve our team of developers, who have ‘grown up’ with Cecil, from legacy code maintenance. The SharePoint pilot has proved that moving to a higher level of abstraction will position the University to deliver core functionality ‘out of the box’ freeing resources for integrating new computer supported learning features. Innovators in the teaching and learning ‘space’ may find the history of Cecil useful as they prepare for fearless change.

AI-led oral assessment through Immersive Simulations: This exploratory project addresses the ASCILITE 2025 conference theme—Future-Focused: Educating in an Era of Continuous Change—by introducing an innovative virtual reality (VR) experience designed for over 300 first-year business students per term. Aligned with the sub-themes of AI and Human Synergy, Inclusive Futures, and Adaptable Learners, students engage deeply with a real-world airline case to explore the SERVQUAL framework (a widely used model and research instrument for assessing service quality): reliability, assurance, tangibles, empathy, and responsiveness.
Advancing TEL Research and Practice: Responding proactively to continuous educational change, this initiative combines immersive technology with AI-led oral assessments. Grounded in contemporary Technology-Enhanced Learning (TEL) literature, it promotes embodied and accessible learning as an alternative to anxiety-inducing traditional oral assessments (Alcorn & Cheesman, 2022; El Shazly, 2021).
Innovative Practice: Students initially explore the airline case study through traditional classroom activities before transitioning to an interactive VR environment. Here, they assume the role of airline customer service staff, interacting with AI-powered avatars portraying airline passengers. This enables students to apply SERVQUAL principles through authentic conversational scenarios. AI-led oral assessments offer immediate, personalised feedback, significantly reducing assessment anxiety, logistical complexity, and associated costs (Alcorn & Cheesman, 2022; Gardner, O’Leary, & Yuan, 2021; Yong, 2020).
Theoretical Foundations: The project integrates experiential learning theory (Kolb, 2015) and cognitive apprenticeship (Matsuo & Tsukube, 2020), providing authentic professional experiences supported by structured opportunities for reflection. Drawing from social constructivist principles (O’Connor, 2022; Richardson, 2003), students collaboratively analyse their VR interactions, fostering critical thinking and resilience. The design highlights AI’s capacity to enhance motivation, reduce anxiety, and support fair, inclusive assessments (Luckin, Holmes, Griffiths, & Forcier, 2016; Rane, Choudhary, & Rane, 2023).
Enhancing Accessibility and Learner Experience: A core aim of this pilot is exploring student acceptance of AI-driven oral assessments, given their novelty compared to traditional methods. Qualitative data collection included surveys, student reflections, and assessor feedback designed to capture key student perspectives on fairness, adaptability, and overall learning experience. Guided by social constructivism, this learner-centred approach is essential for evaluating the effectiveness and scalability of this innovation (Richardson, 2003; O’Connor, 2022).
Cross-disciplinary Relevance: Originally piloted within business education, the flexibility of the VR and AI framework supports adaptation across disciplines including hospitality, healthcare, and law. Flexible access options—from VR headsets to browser-based simulations—ensure inclusivity across diverse learning contexts (Asad, Naz, Churi, Tahanzadeh, & Jermsittiparsert, 2021).
Collaborative Futures and Scholarly Impact: Developed collaboratively with educational technologists and interdisciplinary academics, this project exemplifies innovative digital education. Integrating AI-led assessments aligns with Education 4.0 and 5.0 trends, emphasising personalised and adaptive learning (Rane, Choudhary, & Rane, 2023), and opening avenues for future research into learning analytics, student engagement, and comparative assessments (Gardner et al., 2021; Luckin et al., 2016).
This abstract presents scalable innovation, showcasing the transformative potential of immersive technology and AI-driven assessment in higher education.
 
 

Reviewing the past to imagine the future of elearning: The conference theme 'learning from the past' invites reflection on educational technology research and development in 30 years since Ascilite began; a period of rapid technology adoption and educational change. Common tools have morphed from static, costly devices requiring qualified programmers to low cost mobile ones that virtually every student in the western world uses daily. The social media 'revolution' is democratizing knowledge creation and sharing. People connect for education, professional and social reasons in ways that were inconceivable in the 1980s. This paper summarizes milestones, and asks how well universities use past experience to understand the present and plan for the future. The wisdom of hindsight is unquestionable, while capacity to predict the future is less certain. Some game changing technologies have come out of left field to knock expectations off the radar. The paper concludes by asking if past experience can really help us prepare for a largely unpredictable future.

Making it real - from the street to the online classroom in police education: The design and delivery of effective learning experiences in foundational police practice studies for distance education students is complex and challenging. The many and varied capabilities of computer technologies, in particular the online environment is providing a conduit to connect distance education students with authentic, situated learning experiences and providing a nexus between face to face and distance education police subject delivery. This paper describes the design and implementation of an online module in police investigation studies by Charles Sturt University School of Policing for NSW Police recruit students and the student evaluation of the learning experience. Key findings from the evaluation suggests that online learning delivery which utilises real-time policing scenarios connected the student to the reality of their chosen profession and was preferable to traditional print based curriculum delivery. Further findings from the evaluation informs on future design considerations and the connection between learning opportunities and technologies, a focus of ASCILITE 2010. Importantly, students also suggested that the interactive design of the online modules was compelling, engaging, provided for diverse learner styles whilst allowing for individual rate of progress without fear or favour. 
 

The digital divide between university students and teachers in Hong Kong: A study presented at ASCILITE 2008 (Kennedy, Dalgarno et al., 2008) suggested that the digital divide between students and staff has been overestimated. This study, conducted at The Chinese University of Hong Kong, investigated the ownership and use patterns of a range of digital technologies by a stratified sample of 689 Year 1 Hong Kong students and 56 of their teachers. The study illustrated that our students on the whole are ‘digitally ready’. However, these so-called digital natives are not a homogeneous group and there is variation both in the level of ownership of digital devices and of perceived acquisition of appropriate digital skills. The digital divide between teachers and students is not straight- forward and appear to relate, not to ownership, but to preferences and prior experiences with technology. Factor analysis revealed seven categories of technology-based activities with students reporting higher use and confidence in most areas. Implications for staff development and student-support services are noted.

Do free social networking tools belong in educational environments?: With advancements in technology, principally Web 2.0, social software, and open source tools, learners are challenging what it means to gain an education and be educated. Faculty are starting to explore the potential of blogs, media-sharing services and other social software - which, although not designed specifically for e-learning, can be used to empower students and create exciting new learning opportunities. What is the potential and implications of utilising Web 2.0 tools in online learning courses and as resources? What is the potential of social software tools and how far should they go? Ultimately this is something that institutions will have to determine for themselves. However, enabling the learner to take an active role in shaping their learning with tools that they are currently using may result in institutions seeing more students reach their goals. This interactive session will feature three panelists who will present the spectrum of views based on their own experience and participation in a recent ascilite co-hosted Web 2.0 roundtable. In addition, the session will present US and UK viewpoints on this topic gained by Web 2.0 roundtables hosted in the respective countries. 
 

Connecting or constructing academic literacies on Facebook: This paper outlines proposed doctoral research into how postgraduate students develop academic literacies within the bounds of learning theories and Web 2.0 tools that their lecturers select. Lea and Street’s (1998) academic literacies approach, which views literacies as contested social practices, forms the overarching view of literacy in this research. Over one semester, multiple case studies of postgraduate students will be conducted as they complete a paper within their subject of study. Students will use a private Facebook community to complete learning tasks and engage in student initiated discussions. The learning tasks will provide opportunities to examine the student experience of both the constructivist and connectivist paradigms. The aim is to further understanding of the student experience that can inform the creation of sound, theory driven Web 2.0-based learning tasks that effectively assist students in the development of their academic literacies. Feedback on the proposed research is sought from the Ascilite community.

Professional standards for learning design: Learning design as a profession remains in a liminal space, increasingly central to digital education yet without the formal recognition or collective voice enjoyed by other professional domains. This panel addresses the current lack of shared professional standards by asking: What values, practices and indicators of quality might form the basis of a professional standards framework for learning designers? Drawing on established models from education and technology professions, and sociological theories of professionalisation, the panel invites ASCILITE participants to collaboratively explore what such a framework might look like, how it should be developed, and why it matters. Through guided provocations and participatory workshop activities, attendees will help shape a draft map of core values, domains of practice and levels of expertise, forming the foundation for further community-led work. 
 
 

LIFT as leadership practice: In an era of rapid institutional and digital transformation, navigating leadership in higher education’s third space presents complex identity challenges, particularly for women. Through an interactive autoethnographic process, five participants in the ASCILITE Community Mentoring Program for Women in Leadership (CMP-WiPL) explored these challenges over 18 months, combining personal reflection, peer dialogue, and professional identity practice. Through iterative cycles of self-assessment, professional identity building on LinkedIn, and collaborative discussions within our WiPL Community of Practice (CoP), the group created and refined the Leadership Identity Framework for Transformation (LIFT). Informed by theoretical models of professional identity, third space capabilities, and Communities of Practice, LIFT offers a practical and adaptable approach to scaffold identity development, address imposter syndrome, and fosters inclusive leadership. Findings highlight the power of collective sense-making, digital tools, and structured reflection in supporting professional growth. By framing leadership as a continuous reflective journey, this work provides a sustainable model for enabling confident, authentic leadership in higher education and the third space sectors shaped by uncertainty and change.
 

Navigating the terrain of academic publishing in educational technology: The field of educational technology (EdTech) is characterised by innovation and emerging technologies which continually provide new opportunities to enhance learning environments. As the theme of the Australasian Society for Computers in Learning in Tertiary Education (ASCILITE) 2024 conference suggests, the field explores emerging frontiers in learning spaces, pedagogies, and technologies and findings from this exploration should be made accessible to the community. Academic publishing is a key channel through which outcomes are disseminated to researchers and practitioners. Therefore, it is important to understand the current state of the publishing terrain opportunities can be embraced while also addressing the challenges that threaten the integrity and sustainability of EdTech publishing into the future. In this position paper the current opportunities and challenges relating to EdTech publishing are explored with reference to open data from journal ranking organisations, journal websites, and related literature. The aim is to examine how these issues, including scale, cost, peer review, generative AI, and the integrity of the publishing processes influence the perceived impact of EdTech journals. This discussion informs the identification of key questions that stakeholders in the field need to address to ensure a sustainable and impactful future for EdTech publishing.

Becoming third space: This Pecha Kucha presentation offers a reflective autoethnographic narrative of one third space educational developer’s transition from operational course-level support to co-leadership in the Scholarship of Teaching and Learning (SoTL), curriculum transformation, and digital innovation. Working within a faculty-based initiative that integrates embedded scholarship with academic partnership, this role illustrates how hybrid professionals contribute to institutional transformation through relational, scholarly practice.
The presentation is grounded in Third Space Theory (Whitchurch, 2008), which conceptualises the space between academic and professional roles as a site of emergent identity and leadership. Turner’s (1969) concept of liminality further describes the transitional nature of this work, situated within and across organisational boundaries. The approach is also informed by Hutchings, Huber, and Ciccone’s (2011) integrative vision of SoTL, which emphasises embedded scholarly practice as a catalyst for institutional change. Drawing on Felten’s (2013) principles of good SoTL practice and Lukes et al.’s (2024) strategic tools for building SoTL cultures, the presentation showcases the scholarly agency of third space professionals in enabling evidence-informed teaching and learning improvement.
The twenty-slide narrative unfolds in four interconnected arcs. First, it traces the role evolution from reactive support to proactive scholarly partnership in SoTL. Second, it reflects on hybrid professional identity, including the emotional labour, invisibility, and pursuit of legitimacy often associated with third space roles. Third, it illustrates practice-based contributions to student learning through program-level assessment design, capability framework development, and collaborative SoTL projects. Fourth, it considers institutional enablers and constraints that influence the sustainability and visibility of third space contributions.
Although focused on a single professional trajectory, the presentation contributes to broader sector insights. It foregrounds the methodological and strategic capacities third space professionals bring to academic development and SoTL. It argues that advancing educational transformation requires institutions to embrace more inclusive models of academic-professional partnership and to recognise hybrid roles as core to future-focused learning environments.
Aligned with ASCILITE 2025 themes of Your Journey, Collaborative Futures, and AI and Human Synergy, this Pecha Kucha offers a practitioner-scholar perspective on educational innovation. It invites reflection on how third space professionals can be positioned as co-designers of pedagogical change, and how institutions can foster cultures where collaborative expertise is both valued and sustained.

Communities in practice: An online learning and teaching exchange, integrating a range of communities of practice with a showcase of good practice, and the tools to develop sound teaching approaches - it sounds a fine venture, but what should it encompass? How will it be framed and contextualised? How will it be managed? And – most importantly – whom is it for, and how will it engage users in a meaningful way, embedded into the context of their current practice? This is not an untrodden path, there are numerous examples of exchanges, repositories and communities developed on a grander scale than the one planned for UNSW, most recently the ALTC (formerly Carrick) Exchange, designed and developed under the auspices of ascilite. The designers of the UNSW Learning & Teaching Exchange have learned from and built on these developments, with an intention to eventually complement those wider initiatives. Our Exchange will provide an environment for UNSW academics to share their learning and teaching practice and develop their academic career in a local context, aiming to integrate local activities with wider initiatives in learning and teaching research and practice nationally and internationally. This paper draws on the literature on communities of practice and the scholarship of teaching and learning, and reviews some recent online developments in higher education that informed the planning of the UNSW Learning & Teaching Exchange.

Women Leading in the Third space: As Third Space educators, we work at the ""interface between professional and academic activity"" (Whitchurch, 2013, p. 55). Career progression in the Third Space is less defined and structured compared to traditional academic progression. This lack of structure and definition, paired with women being more likely to move into Third Space roles, contributes to women being underrepresented in senior leadership roles in university settings (Denney, 2021). Being in this less understood space may also result in feelings of isolation and disconnect, particularly with the rise of remote work.  This adds to the difficulties of staying abreast of the complexity of higher education, continuous evolution of technologies (generative AI), and diverse student needs. These factors demand that practitioners continually update their expertise and career profiles.
LinkedIn is a platform for professional networking, collaborative learning space for career development, and supports over one billion users with features such as LinkedIn Learning, versatile profiles, and AI-driven career advice (LinkedIn, 2024). For Third Space professionals, it provides valuable opportunities to network, share achievements, and build personal and professional brands (Loganathan, 2023; Rycraft, 2018).  A LinkedIn profile is a valuable job seeking tool and requires meaningful interaction and engagement.  Challenges in using this platform include experiencing anxiety and imposter syndrome, resulting from comparisons with others (Marder et al, 2023). Women are less likely to leverage LinkedIn for promoting themselves, for example under utilising the summary field (Altenburger et al, 2017). Therefore, our team, focused on leveraging this platform to address these challenges to support the growth and leadership of women in the Third Space.
This poster presents an interactive autoethnographic study as described by Chang (2008), to engage in self-reflective practice and connections, to examine how LinkedIn can enhance our professional identities as women in leadership roles within higher education and the Third Space. Conducted as part of the ASCILITE Community Mentoring Program for Women in Professional Leadership, we aim to support each other in career progression, reflective practice, and cross-university connections. Our approach was informed by Wenger’s (1998) communities of practice theory, which underscores the role of professional networks in fostering learning and growth, and the conceptual frameworks for Professional Identity (Bulei & Dinu, 2013) and Third Space capabilities (Henry & Boreland, 2024). This study involved self-assessment of LinkedIn profiles, best practices, and refining our approaches based on internal reflections and community feedback.
Our initial findings indicate that regular engagement, thoughtful content curation, and active participation in professional groups significantly enhance visibility and networking. Well-developed LinkedIn profiles are personable and linked to ePortfolios. Mentorship and community support are vital in shaping strategies, fostering solidarity and collective growth.
Our poster will present a conceptual framework for optimising LinkedIn to build professional identities for women in leadership within the Third Space. We aim to provide valuable insights for aspiring women leaders, helping them navigate the evolving educational landscape and build supportive professional communities.

First year student engagement, discussion forums, and reflections on mentoring practice: As part of the ascilite community mentoring program, an exploratory study was initiated on the use of discussion forums and online activities for first year student engagement in the life sciences. This was started in first semester and based upon the discoveries made, modified for second semester. The results indicated that outcomes were poor for first semester, and positive for second semester when marks were assigned for the participation in the discussion forums. 
  
 

It's what you do with IT that matters!: 'The reality is that technology is doing more harm than good in our schools' says education chief (Bagshaw, 2016, article title). This April 1st headline for a Sydney Morning Herald article was no April Fool's joke. It referenced comments made in an address by OECD education director Andreas Schleicher at a global education forum. The statement is quite poignant for the ASCILITE (2016) conference given its theme is 'Show me the learning' focussing upon 'demonstration of learning aided by the adoption of technology in the education space' (para 4). This paper will examine questions raised by these comments, vignettes from a doctoral study that offer some answers to them, and propose the need for holistic assessment of contexts to more fully understand what is happening within them. It is suggested that while this paper is particularly relevant to initial teacher education, the principles are applicable to tertiary education more broadly.

A lexical analysis of 1995, 2000 and 2005 ascilite conference papers: Papers from the 1991, 2000 and 2005 ascilite conferences were analysed to identify key themes and concepts that have emerged from the thinking and research of Australian academics working with learning technologies. In 1995, themes were related to student learning and software / multimedia development. In 2000 there was a focus on student learning and specific products. In 2005, the online learning environment, learning activities and outcomes were key themes. Key themes in the whole collection of papers were the examination of most facets of “going online” and learning activities/assessment.
 

Reflections on Mentoring: This reflective narrative explores the experiences of a mentoring group of three involved with the ASCILITE Women in Academic Leadership program (WiAL). It considers the difficulties and isolation which women in academe can face, specifically where their interests align with Technology Enhanced Learning. It demonstrates how support builds resilience to develop impact statements to enable recognition through promotion and awards. Through these accounts, the value of lived experience and shared interest underpins the success of the mentoring program and highlights how the lack of power structures can enhance mentoring outcomes.  
 

Forging the path in the third space: This concise paper explores the role of learning designers as third-space professionals in higher education, exploring both their self-perception and the perceptions held by other professionals in the sector. Learning designers play a crucial role in learning support, program design, web-based learning, and industry partnerships, being also able to challenge traditional practices and enhance student experiences and outcomes. However, a comprehensive understanding of their roles remains complex and necessitates further exploration. The challenges faced by learning designers include ambiguous role definitions and the delicate balance of meeting diverse stakeholder expectations. Through an autoethnographic approach, members from an ASCILITE Community Mentoring Program group offer insights into the multifaceted contributions of learning designers. Recognizing, working collaboratively with, and appreciating the diverse expertise of learning designers are key factors for universities to effectively address recent societal changes and meet the evolving needs of their students.

Reviewing the progress of a campus-wide e-portfolio rollout: This poster updates the community on the progress of the campus-wide e-portfolio rollout at the University of Wollongong, since it was reported on at the ASCILITE 2006 conference. During 2007 additional Faculties have come on board to develop a Faculty or program customised template and to release this to their students, and additional Careers Service programs have also developed e-portfolios. By August 2007 around 1200 e- portfolios have been released to students and around 150 have been released to staff. 2 early adopters (teachers) have been interviewed to discuss how they integrated the e- portfolio into the context of their particular subjects, and reflecting on how this could be improved. Plans for further development and dissemination are discussed including links to the Carrick funded national e-portfolio study.
 
 

Sustaining new approaches to learning and teaching with technology: The basic premise of the 2012 Ascilite Conference theme is that; ‘what happened in the past is no longer a reliable guide to the future’. However, if we do not learn from what happened in the past, it may well be a reliable guide to an unsustainable future. In the face of constant change, in order for higher education institutions to achieve the goal of creating sustainable approaches to new models and learning and teaching with technology a fundamental paradigm shift in management approaches is required. To address this, an interdisciplinary focus is introduced and two key concepts from environmental management: Wicked Problems and adaptive management are applied to the higher education environment. Using evidence-based practice these aspects have been researched in-depth in a large, mixed-mode university.

New beginnings: The ALTC Exchange is an online service that provides learning and teaching resources and facilities to support professional communication and collaboration across the Australian higher education sector. Released in May 2008, the Exchange is an integral part of the ALTC's strategy for disseminating good practice and aimed at fostering change and development in learning and teaching. Membership is open to academics, managers, and leaders of learning and teaching in Australian higher education and internationally. 
Considerable input into the design requirements and development of the Exchange has been made by practitioners, sector leaders, professional associations including ascilite members and other interested teaching and learning professionals. In August 2009 an extensive upgrade to the Exchange was released. This paper reports on the current status of the Exchange and outlines recent developments to improve usability and enhance functionality.

Blogging for learning: This paper provides the background and context to a pilot study to investigate the use of blogs (personal reflections) and wikis/clogs (blogs used for collaborative reflections) to support authentic learning, communication and the development of communities of practice within a higher education environment. The study is supported by the ascilite Community Mentoring Program and the results of the investigation will be reported in full at the conference.
 

E-teachers collaborating: This paper is the final report on this research project as required by the ASCILITE research grant conditions and outlines the research project background, rationale and methodology, and discusses results and conclusions. The project initiated the process of collegial development of a theoretically informed framework which enabled lecturers to retrospectively analyse what they did to create an effective online teacher presence and thereby facilitate a more productive online learning environment for their students. The project involved a pilot group of tertiary e-teachers interacting with an established theoretical framework - seven principles for good practice in undergraduate education (Chickering and Gamson, 1987). They developed, by a consensus process, using a mixture of face-to-face interaction and an online wiki, an extended version of this framework to analyse online interactions for evidence of their teacher presence. Working as a collegial group, lecturers then formulated a process which facilitated peer analysis and review of this data to identify both strengths and areas for further professional learning. Lecturers were invited to self-review an online course which contained examples of online interaction – these were discussed in triads with two other colleagues acting as peer reviewer and interviewer. Several themes emerged from the project conclusions – the framework developed had much in common with other existing evaluative frameworks, staff involved generally reported the process as a positive one, with greater commitment and ownership because of the collegial development, and one of the difficulties participants encountered was the time commitment required.

Spatialities and online teaching: “Hello! Is anyone out there?” might be the echo of many an online lecturer, but perhaps a louder echo might be in the question “Hello! Where are you in the educational landscape?” For our locations and spatialities are inevitably entangled with who we are and who we might become. We are always emplaced (Malpas, 1999), and so in the changing pedagogical spaces of academe, I argue that spatialities are inextricably linked with identity performances and teaching practices - these configure and are configured by each other. In the postmodern university, online spaces are changing traditional academic life. As Lefebvre puts it “to change life is to change space; to change space is to change life” (Merrifield, 2000: 173). This paper explores transformations in online teaching in terms of identity, spatiality and online teaching practices in the everyday experiences of online lecturers using the socio-material lens of Actor-Network-Theory. Drawing from a larger qualitative ethnographic study within an Australian university, the experiences of 4 online lecturers are discussed in terms of (re)configurations of their identities, teaching practices and spaces/places (physical and online), as well as their evolving online teaching metaphors; relating to the conference themes of: “What are the changing relationships between people, the virtual and the physical, and objects in the educational technology landscape?”; and “What does it mean to be an online scholar in the educational technology landscape – who, what, when, where, how and why?” (ascilite, 2008). It is concluded that these conceptual and empirical insights can enrich our understanding of online teaching transformations in terms of identity and spatiality in shifting pedagogical landscapes – to, from and beyond the traditional places of the academy. 
  
 

Community, exchange and diversity: The Carrick Exchange is a significant new online service that will provide communication and collaboration services, and learning and teaching resources across the Australian and international higher education sectors. The Carrick Exchange is sponsored by the Carrick Institute for Learning and Teaching in Higher Education. It is for those who teach, manage and lead learning and teaching in Australian higher education. The Carrick Exchange aims to provide access to quality learning materials and resources; information about new technologies and ideas that impact on teaching practice and student learning; opportunities for academic and support staff to network with others, comment on and exchange ideas; and a means for academics to participate in discussions, debates and dialogue about teaching. This paper reports on the first component of the Stage 2 ascilite research into the Carrick Exchange. Using a design-based research approach, the ascilite project team investigated the human issues involved in development of the Carrick Exchange. Twenty-nine key practitioners were interviewed. The interviews generated a comprehensive discipline, cross-institutional, national and international perspective of user needs and contexts of use for a national online repository. The interview findings were analysed in relation to engagement, resource identification and contribution, and peer review. The findings presented in this paper will inform the design, management, utilisation and associated processes of the Carrick Exchange. 
  
 

The dimensions of being open: Based on the concept of a continuum of openness, this session will respond to the Australian contextualisation of Open Educational Practices (OEP) in higher education, and openness more broadly within different institutions. This will be undertaken through brief cases of implementation at the panellists’ institutions, with an invitation to the audience to expand, and contribute to, the ongoing Australian OEP dialogue. The complexity, considerations for engagement, and practical examples will be considered to catalyse discussion with the audience. The panel will also discuss possible challenges facing practitioners and their institutions, and opportunities to explore future directions, as well as the roles the OEP SIG, as part of the ASCILITE community, could play in progressing and nurturing OEP developments in Australia.",success
