id,title,acronym,paper_count,paper_text,status
46ACC,46th Australasian Conference on Combinatorial Mathematics and Combinatorial Computing,46ACC,0,,skipped-no-papers
AAAC,Symposium of Asian Association for Algorithms and Computation,AAAC,0,,skipped-no-papers
